<?xml version="1.0" encoding="utf-8" ?>
<!DOCTYPE faml SYSTEM "/faml.dtd">
<faml>
    <meta>
        <id>cubecraft:video_setting_screen</id>
        <type>super</type>
        <parent>super</parent>
    </meta>
    <elements>
        <label>
            <layout>{
                "type": "origin", "layout": [0,-10,300,30],
                "meta": "middle_middle", "layer": 0,"border":[0,0,4,4]
                }
            </layout>
            <text type="lang" color="ffffff" align="middle">option.video.title</text>
        </label>
    </elements>
</faml>